{
  "schema_version": 1,
  "created_at": "2026-08-25T15:54:22.000Z",
  "mode": "comparison",
  "suite": "evaluations/skills/meteor-methods/cases.json",
  "suite_snapshot": "evaluations/snapshots/957d3d4757e90054b7d11ef3df55780634d3ec8adc7973ff4650ae2f5ae65fca.json",
  "suite_sha256": "957d3d4757e90054b7d11ef3df55780634d3ec8adc7973ff4650ae2f5ae65fca",
  "skill_version": "0.4.1",
  "agent_skills": {
    "revision": "47d904ddfffefd16b45e1d54522ff9d997b2faac",
    "dirty": true
  },
  "meteor": {
    "remote": "https://github.com/meteor/meteor.git",
    "revision": "5cafdbc20f5afe5ec82430700d046f7f6ce2b2fe",
    "release": "case-specific suite context; no Meteor runtime executed",
    "dirty": true
  },
  "environment": {
    "client": "Codex CLI 0.149.1",
    "model": "gpt-5.5 with low reasoning",
    "platform": "Ubuntu 22.04 x86_64, Node.js 22.22.3"
  },
  "claims": ["behavior"],
  "runs": [
    {
      "case_id": "async-rate-limit-matcher",
      "repetition": 1,
      "condition": "current-skill",
      "fixture_sha256": "bc0d50d5670841a1e84148d6c08d495ca759805c474ac06125137b9c591a1bdd",
      "status": "pass",
      "duration_ms": 22650,
      "assertions": [
        {
          "id": "uses-async-user-matcher",
          "passed": true,
          "evidence": "The Meteor 3.5 example uses an async userId matcher and awaits Meteor.users.findOneAsync."
        },
        {
          "id": "keeps-query-bounded",
          "passed": true,
          "evidence": "The lookup projects subscriptionTier and the response explains that the connection message queue awaits it."
        },
        {
          "id": "covers-rejected-promise",
          "passed": true,
          "evidence": "The response says a rejected matcher Promise fails the invocation before the method body and explicitly calls for testing that path."
        }
      ],
      "artifacts": [
        "evaluations/.work/2026-08-25-codex-gpt-5.5-r2/meteor-methods/async-rate-limit-matcher/current-skill/response.md"
      ]
    },
    {
      "case_id": "async-rate-limit-matcher",
      "repetition": 1,
      "condition": "without-skill",
      "fixture_sha256": "bc0d50d5670841a1e84148d6c08d495ca759805c474ac06125137b9c591a1bdd",
      "status": "pass",
      "duration_ms": 19671,
      "assertions": [
        {
          "id": "uses-async-user-matcher",
          "passed": true,
          "evidence": "The response uses an async userId matcher with a projected findOneAsync lookup."
        },
        {
          "id": "keeps-query-bounded",
          "passed": true,
          "evidence": "It keeps the query narrow and states that awaiting it delays later messages on the same connection."
        },
        {
          "id": "covers-rejected-promise",
          "passed": true,
          "evidence": "It states that rejection errors the invocation and recommends handling expected cases without throwing."
        }
      ],
      "artifacts": [
        "evaluations/.work/2026-08-25-codex-gpt-5.5-r2/meteor-methods/async-rate-limit-matcher/without-skill/response.md"
      ]
    }
  ],
  "summary": {
    "classification": "no-gap",
    "notes": "The maintenance rerun passed all three async matcher assertions in both conditions. The current skill now places connection queue cost, projected lookup guidance, rejected Promise behavior, and an explicit rejection test in its main body. The clarified prompt also elicited the documented behavior without the skill, so this rerun supports regression closure but makes no new skill-edge claim. The earlier full-suite report remains the evidence that the previous skill changed an incorrect synchronous answer into a Meteor 3.5-compatible one. One repetition supports behavior only."
  }
}
